{"abi_version":1,"artifact_graph_ref":"r4_artifact_graph_v4:78ca19ac01799eb447631018","authority_generation":"authority-v1-2026-07-29","authorization_ref":"r4_class_authorization_v1:13bfeee0232c093fb55ea843","expected_capability_ref":"r4_class_capability_v1:17ab6895da12ff6c39e1a5b9","expected_capability_sha256":"0f19e71003e42168366469d84052a07d6bb99c4f388944111a432c252c9afc4b","generator_source_revision":"0e5cc80195047ae6401070e21c05954e26c3e299","purpose":"training"}
